{
  "$schema": "https://json-schema.org/draft/2020-12/schema",
  "$id": "https://example.com/schema/evaluation-dataset.schema.json",
  "title": "GuidelineRagEvaluationDataset",
  "description": "Schema for evaluation items used to test retrieval, answer quality, guardrails, and A/B variants in the German oncology guideline RAG app.",
  "type": "array",
  "items": {
    "type": "object",
    "additionalProperties": false,
    "properties": {
      "id": {
        "type": "string",
        "description": "Unique evaluation item identifier."
      },
      "dataset_split": {
        "type": "string",
        "enum": ["eval", "ab_test", "guardrail", "smoke"],
        "description": "Logical dataset split used for scoring or test execution."
      },
      "expected_behavior": {
        "type": ["string", "null"],
        "enum": ["answer", "refuse", "redact_and_answer", "warn", "ask_clarification", null],
        "description": "Expected high-level system behavior for this item, especially useful for guardrail and smoke-test cases."
      },
      "question": {
        "type": "string",
        "description": "User question or prompt in German."
      },
      "question_type": {
        "type": "string",
        "enum": [
          "factual",
          "recommendation",
          "evidence",
          "comparison",
          "lookup_empfehlung",
          "drug_lookup",
          "external",
          "guardrail"
        ],
        "description": "Primary question category aligned with routing and tool behavior."
      },
      "difficulty": {
        "type": ["string", "null"],
        "enum": ["easy", "medium", "hard", null],
        "description": "Estimated difficulty of the evaluation item."
      },
      "guideline_scope": {
        "type": "array",
        "description": "Guidelines relevant to the question.",
        "items": {
          "type": "string"
        },
        "default": []
      },
      "source_chunk_ids": {
        "type": "array",
        "description": "Seed source chunks from which the question was derived.",
        "items": {
          "type": "string"
        },
        "default": []
      },
      "expected_answer": {
        "type": ["string", "null"],
        "description": "Reference answer used for correctness and answer-quality evaluation."
      },
      "expected_answer_plain_language": {
        "type": ["string", "null"],
        "description": "Optional reference answer for the plain-language response layer."
      },
      "expected_recommendation_metadata": {
        "type": ["object", "null"],
        "additionalProperties": false,
        "description": "Expected recommendation-level metadata that should be preserved in recommendation-focused answers.",
        "properties": {
          "recommendation_id": {
            "type": ["string", "null"]
          },
          "recommendation_grade": {
            "type": ["string", "null"]
          },
          "consensus_strength": {
            "type": ["string", "null"]
          },
          "evidence_level": {
            "type": ["string", "null"]
          }
        }
      },
      "gold_chunk_ids": {
        "type": "array",
        "description": "Gold retrieval chunk identifiers considered relevant for the question.",
        "items": {
          "type": "string"
        },
        "default": []
      },
      "gold_sections": {
        "type": "array",
        "description": "Relevant section paths or recommendation labels expected in support of the answer.",
        "items": {
          "type": "string"
        },
        "default": []
      },
      "gold_pages": {
        "type": "array",
        "description": "Relevant page numbers expected in retrieval results or citations.",
        "items": {
          "type": "integer",
          "minimum": 1
        },
        "default": []
      },
      "required_citations": {
        "type": "array",
        "description": "Citation anchors that should appear in a grounded answer or be directly traceable during evaluation.",
        "items": {
          "type": "object",
          "additionalProperties": false,
          "properties": {
            "chunk_id": {
              "type": ["string", "null"]
            },
            "page_start": {
              "type": ["integer", "null"],
              "minimum": 1
            },
            "page_end": {
              "type": ["integer", "null"],
              "minimum": 1
            },
            "section_path": {
              "type": "array",
              "items": {
                "type": "string"
              },
              "default": []
            },
            "recommendation_id": {
              "type": ["string", "null"]
            },
            "citation_importance": {
              "type": "string",
              "enum": ["must", "should", "optional"]
            }
          },
          "required": ["citation_importance"]
        },
        "default": []
      },
      "expected_filters": {
        "type": "object",
        "additionalProperties": false,
        "description": "Optional metadata filters expected to be relevant to the query.",
        "properties": {
          "guideline_id": {
            "type": ["string", "null"]
          },
          "recommendation_grade": {
            "type": ["string", "null"]
          },
          "chunk_type": {
            "type": ["string", "null"]
          }
        }
      },
      "requires_comparison": {
        "type": "boolean",
        "description": "Whether the system should compare multiple guidelines or sources."
      },
      "needs_pubmed": {
        "type": "boolean",
        "description": "Whether the question is expected to trigger external PubMed usage."
      },
      "requires_clarification": {
        "type": "boolean",
        "description": "Whether the query is clinically underspecified and the system should ask a clarification question before retrieval or answer generation."
      },
      "missing_clinical_dimensions": {
        "type": "array",
        "description": "Structured list of missing clinical context dimensions needed for a safe answer.",
        "items": {
          "type": "string"
        },
        "default": []
      },
      "clarification_rationale": {
        "type": ["string", "null"],
        "description": "Human-readable explanation of why clarification is needed."
      },
      "expected_clarification": {
        "type": ["string", "null"],
        "description": "Expected clarification question the assistant should ask before retrieval or answer generation."
      },
      "claim_verdict": {
        "type": ["string", "null"],
        "enum": ["supported", "contradicted", "misleading", "not_in_guideline", null],
        "description": "Expected verdict for claim-verification or contradiction-trap style prompts."
      },
      "expected_answer_format": {
        "type": ["string", "null"],
        "enum": ["concise", "structured", "comparative", "explanatory", "refusal", null],
        "description": "Expected response shape at the UX layer."
      },
      "expected_answer_sections": {
        "type": "array",
        "description": "Expected logical answer blocks such as recommendation, evidence, citations, plain_language, or clarification.",
        "items": {
          "type": "string"
        },
        "default": []
      },
      "retrieval_challenge_types": {
        "type": "array",
        "description": "Multi-label taxonomy describing why retrieval may be difficult for this item.",
        "items": {
          "type": "string"
        },
        "default": []
      },
      "should_refuse": {
        "type": "boolean",
        "description": "Whether the system should refuse or redirect the request."
      },
      "should_redact_pii": {
        "type": "boolean",
        "description": "Whether the input contains PII that should be redacted during processing."
      },
      "expected_tools": {
        "type": "array",
        "description": "Optional list of expected tools or tool families likely to be used.",
        "items": {
          "type": "string"
        },
        "default": []
      },
      "notes": {
        "type": ["string", "null"],
        "description": "Optional human curation notes about the item."
      }
    },
    "allOf": [
      {
        "if": {
          "properties": {
            "requires_clarification": {
              "const": true
            }
          },
          "required": ["requires_clarification"]
        },
        "then": {
          "required": [
            "missing_clinical_dimensions",
            "expected_clarification"
          ]
        }
      },
      {
        "if": {
          "properties": {
            "dataset_split": {
              "const": "guardrail"
            }
          },
          "required": ["dataset_split"]
        },
        "then": {
          "required": [
            "id",
            "dataset_split",
            "question",
            "question_type",
            "should_refuse",
            "should_redact_pii"
          ]
        }
      }
    ],
    "required": [
      "id",
      "dataset_split",
      "question",
      "question_type",
      "guideline_scope",
      "requires_comparison",
      "needs_pubmed",
      "requires_clarification",
      "missing_clinical_dimensions",
      "should_refuse",
      "should_redact_pii"
    ]
  }
}